{
  "$schema": "https://json-schema.org/draft/2020-12/schema",
  "$id": "batch.schema.json",
  "title": "GameStats MatchBatch (Go -> Scala)",
  "description": "Cuerpo de POST /analyze. Todos los eventos deben tener el mismo matchId y gameId que el lote, y venir ordenados por timestamp.",
  "type": "object",
  "required": ["matchId", "gameId", "gameVersion", "startedAt", "finishedAt", "players", "events"],
  "properties": {
    "matchId":     { "type": "string", "minLength": 1 },
    "gameId":      { "enum": ["racing", "football", "fighting", "tetris"] },
    "gameVersion": { "type": "string", "minLength": 1 },
    "startedAt":   { "type": "string", "format": "date-time" },
    "finishedAt":  { "type": "string", "format": "date-time" },
    "players":     { "type": "array", "items": { "type": "string", "minLength": 1 }, "uniqueItems": true },
    "events":      { "type": "array", "items": { "$ref": "event.schema.json" }, "minItems": 1 }
  }
}
