{
  "matchId": "race-001",
  "gameId": "racing",
  "gameVersion": "1.0",
  "startedAt": "2026-10-05T14:00:00Z",
  "finishedAt": "2026-10-05T14:04:10Z",
  "players": ["p1", "p2", "p3"],
  "events": [
    { "eventId": "r1-e01", "timestamp": "2026-10-05T14:00:00Z", "gameId": "racing", "gameVersion": "1.0", "matchId": "race-001", "type": "MATCH_STARTED", "data": { "track": "monza", "laps": 3 } },
    { "eventId": "r1-e02", "timestamp": "2026-10-05T14:00:01Z", "gameId": "racing", "gameVersion": "1.0", "matchId": "race-001", "playerId": "p1", "type": "PLAYER_JOINED", "data": {} },
    { "eventId": "r1-e03", "timestamp": "2026-10-05T14:00:02Z", "gameId": "racing", "gameVersion": "1.0", "matchId": "race-001", "playerId": "p2", "type": "PLAYER_JOINED", "data": {} },
    { "eventId": "r1-e04", "timestamp": "2026-10-05T14:00:03Z", "gameId": "racing", "gameVersion": "1.0", "matchId": "race-001", "playerId": "p3", "type": "PLAYER_JOINED", "data": {} },

    { "eventId": "r1-e05", "timestamp": "2026-10-05T14:01:21.800Z", "gameId": "racing", "gameVersion": "1.0", "matchId": "race-001", "playerId": "p2", "type": "PLAYER_ACTION", "action": "LAP_COMPLETED", "data": { "lap": 1, "lapTimeMs": 81800, "position": 1 } },
    { "eventId": "r1-e06", "timestamp": "2026-10-05T14:01:22.000Z", "gameId": "racing", "gameVersion": "1.0", "matchId": "race-001", "playerId": "p1", "type": "PLAYER_ACTION", "action": "LAP_COMPLETED", "data": { "lap": 1, "lapTimeMs": 82000, "position": 2 } },
    { "eventId": "r1-e07", "timestamp": "2026-10-05T14:01:23.000Z", "gameId": "racing", "gameVersion": "1.0", "matchId": "race-001", "playerId": "p3", "type": "PLAYER_ACTION", "action": "LAP_COMPLETED", "data": { "lap": 1, "lapTimeMs": 83000, "position": 3 } },

    { "eventId": "r1-e08", "timestamp": "2026-10-05T14:02:30Z", "gameId": "racing", "gameVersion": "1.0", "matchId": "race-001", "playerId": "p1", "type": "PLAYER_ACTION", "action": "POSITION_CHANGED", "data": { "from": 2, "to": 1, "lap": 2 } },
    { "eventId": "r1-e09", "timestamp": "2026-10-05T14:02:30Z", "gameId": "racing", "gameVersion": "1.0", "matchId": "race-001", "playerId": "p2", "type": "PLAYER_ACTION", "action": "POSITION_CHANGED", "data": { "from": 1, "to": 2, "lap": 2 } },

    { "eventId": "r1-e10", "timestamp": "2026-10-05T14:02:43.500Z", "gameId": "racing", "gameVersion": "1.0", "matchId": "race-001", "playerId": "p1", "type": "PLAYER_ACTION", "action": "LAP_COMPLETED", "data": { "lap": 2, "lapTimeMs": 81500, "position": 1 } },
    { "eventId": "r1-e11", "timestamp": "2026-10-05T14:02:44.000Z", "gameId": "racing", "gameVersion": "1.0", "matchId": "race-001", "playerId": "p2", "type": "PLAYER_ACTION", "action": "LAP_COMPLETED", "data": { "lap": 2, "lapTimeMs": 82200, "position": 2 } },
    { "eventId": "r1-e12", "timestamp": "2026-10-05T14:02:45.800Z", "gameId": "racing", "gameVersion": "1.0", "matchId": "race-001", "playerId": "p3", "type": "PLAYER_ACTION", "action": "LAP_COMPLETED", "data": { "lap": 2, "lapTimeMs": 82800, "position": 3 } },

    { "eventId": "r1-e13", "timestamp": "2026-10-05T14:03:10Z", "gameId": "racing", "gameVersion": "1.0", "matchId": "race-001", "playerId": "p3", "type": "PLAYER_ACTION", "action": "PENALTY", "data": { "seconds": 5, "reason": "track_limits" } },

    { "eventId": "r1-e14", "timestamp": "2026-10-05T14:04:04.400Z", "gameId": "racing", "gameVersion": "1.0", "matchId": "race-001", "playerId": "p1", "type": "PLAYER_ACTION", "action": "LAP_COMPLETED", "data": { "lap": 3, "lapTimeMs": 80900, "position": 1 } },
    { "eventId": "r1-e15", "timestamp": "2026-10-05T14:04:05.600Z", "gameId": "racing", "gameVersion": "1.0", "matchId": "race-001", "playerId": "p2", "type": "PLAYER_ACTION", "action": "LAP_COMPLETED", "data": { "lap": 3, "lapTimeMs": 81600, "position": 2 } },
    { "eventId": "r1-e16", "timestamp": "2026-10-05T14:04:08.300Z", "gameId": "racing", "gameVersion": "1.0", "matchId": "race-001", "playerId": "p3", "type": "PLAYER_ACTION", "action": "LAP_COMPLETED", "data": { "lap": 3, "lapTimeMs": 82500, "position": 3 } },

    { "eventId": "r1-e17", "timestamp": "2026-10-05T14:04:10Z", "gameId": "racing", "gameVersion": "1.0", "matchId": "race-001", "type": "MATCH_FINISHED", "data": { "ranking": ["p1", "p2", "p3"] } }
  ]
}
