{
  "matchId": "foot-001",
  "gameId": "football",
  "gameVersion": "1.0",
  "startedAt": "2026-10-05T16:00:00Z",
  "finishedAt": "2026-10-05T17:30:00Z",
  "players": ["p1", "p2", "p3", "p4"],
  "events": [
    { "eventId": "f1-e01", "timestamp": "2026-10-05T16:00:00Z", "gameId": "football", "gameVersion": "1.0", "matchId": "foot-001", "type": "MATCH_STARTED", "data": { "homeTeam": "A", "awayTeam": "B" } },
    { "eventId": "f1-e02", "timestamp": "2026-10-05T16:00:01Z", "gameId": "football", "gameVersion": "1.0", "matchId": "foot-001", "playerId": "p1", "type": "PLAYER_JOINED", "data": { "teamId": "A" } },
    { "eventId": "f1-e03", "timestamp": "2026-10-05T16:00:02Z", "gameId": "football", "gameVersion": "1.0", "matchId": "foot-001", "playerId": "p2", "type": "PLAYER_JOINED", "data": { "teamId": "A" } },
    { "eventId": "f1-e04", "timestamp": "2026-10-05T16:00:03Z", "gameId": "football", "gameVersion": "1.0", "matchId": "foot-001", "playerId": "p3", "type": "PLAYER_JOINED", "data": { "teamId": "B" } },
    { "eventId": "f1-e05", "timestamp": "2026-10-05T16:00:04Z", "gameId": "football", "gameVersion": "1.0", "matchId": "foot-001", "playerId": "p4", "type": "PLAYER_JOINED", "data": { "teamId": "B" } },

    { "eventId": "f1-e06", "timestamp": "2026-10-05T16:05:00Z", "gameId": "football", "gameVersion": "1.0", "matchId": "foot-001", "playerId": "p2", "type": "PLAYER_ACTION", "action": "PASS", "data": { "teamId": "A", "targetId": "p1", "success": true, "distance": 18.5, "minute": 5 } },
    { "eventId": "f1-e07", "timestamp": "2026-10-05T16:05:10Z", "gameId": "football", "gameVersion": "1.0", "matchId": "foot-001", "playerId": "p1", "type": "PLAYER_ACTION", "action": "SHOT", "data": { "teamId": "A", "onTarget": true, "minute": 5 } },
    { "eventId": "f1-e08", "timestamp": "2026-10-05T16:05:11Z", "gameId": "football", "gameVersion": "1.0", "matchId": "foot-001", "playerId": "p1", "type": "PLAYER_ACTION", "action": "GOAL", "data": { "teamId": "A", "assistId": "p2", "minute": 5 } },

    { "eventId": "f1-e09", "timestamp": "2026-10-05T16:12:00Z", "gameId": "football", "gameVersion": "1.0", "matchId": "foot-001", "playerId": "p3", "type": "PLAYER_ACTION", "action": "PASS", "data": { "teamId": "B", "targetId": "p4", "success": true, "distance": 22.0, "minute": 12 } },
    { "eventId": "f1-e10", "timestamp": "2026-10-05T16:12:30Z", "gameId": "football", "gameVersion": "1.0", "matchId": "foot-001", "playerId": "p4", "type": "PLAYER_ACTION", "action": "PASS", "data": { "teamId": "B", "targetId": "p3", "success": false, "distance": 30.0, "minute": 12 } },
    { "eventId": "f1-e11", "timestamp": "2026-10-05T16:20:00Z", "gameId": "football", "gameVersion": "1.0", "matchId": "foot-001", "playerId": "p4", "type": "PLAYER_ACTION", "action": "FOUL", "data": { "teamId": "B", "card": "yellow", "minute": 20, "targetId": "p1" } },
    { "eventId": "f1-e12", "timestamp": "2026-10-05T16:25:00Z", "gameId": "football", "gameVersion": "1.0", "matchId": "foot-001", "playerId": "p3", "type": "PLAYER_ACTION", "action": "SHOT", "data": { "teamId": "B", "onTarget": false, "minute": 25 } },
    { "eventId": "f1-e13", "timestamp": "2026-10-05T16:33:00Z", "gameId": "football", "gameVersion": "1.0", "matchId": "foot-001", "playerId": "p1", "type": "PLAYER_ACTION", "action": "PASS", "data": { "teamId": "A", "targetId": "p2", "success": true, "distance": 15.0, "minute": 33 } },
    { "eventId": "f1-e14", "timestamp": "2026-10-05T16:40:00Z", "gameId": "football", "gameVersion": "1.0", "matchId": "foot-001", "playerId": "p2", "type": "PLAYER_ACTION", "action": "PASS", "data": { "teamId": "A", "targetId": "p1", "success": false, "distance": 25.0, "minute": 40 } },
    { "eventId": "f1-e15", "timestamp": "2026-10-05T16:52:00Z", "gameId": "football", "gameVersion": "1.0", "matchId": "foot-001", "playerId": "p2", "type": "PLAYER_ACTION", "action": "FOUL", "data": { "teamId": "A", "card": "none", "minute": 52, "targetId": "p3" } },

    { "eventId": "f1-e16", "timestamp": "2026-10-05T17:01:00Z", "gameId": "football", "gameVersion": "1.0", "matchId": "foot-001", "playerId": "p2", "type": "PLAYER_ACTION", "action": "PASS", "data": { "teamId": "A", "targetId": "p1", "success": true, "distance": 20.0, "minute": 61 } },
    { "eventId": "f1-e17", "timestamp": "2026-10-05T17:01:15Z", "gameId": "football", "gameVersion": "1.0", "matchId": "foot-001", "playerId": "p1", "type": "PLAYER_ACTION", "action": "SHOT", "data": { "teamId": "A", "onTarget": true, "minute": 61 } },
    { "eventId": "f1-e18", "timestamp": "2026-10-05T17:01:16Z", "gameId": "football", "gameVersion": "1.0", "matchId": "foot-001", "playerId": "p1", "type": "PLAYER_ACTION", "action": "GOAL", "data": { "teamId": "A", "minute": 61 } },
    { "eventId": "f1-e19", "timestamp": "2026-10-05T17:10:00Z", "gameId": "football", "gameVersion": "1.0", "matchId": "foot-001", "playerId": "p2", "type": "PLAYER_ACTION", "action": "SHOT", "data": { "teamId": "A", "onTarget": false, "minute": 70 } },

    { "eventId": "f1-e20", "timestamp": "2026-10-05T17:15:00Z", "gameId": "football", "gameVersion": "1.0", "matchId": "foot-001", "playerId": "p4", "type": "PLAYER_ACTION", "action": "PASS", "data": { "teamId": "B", "targetId": "p3", "success": true, "distance": 12.0, "minute": 75 } },
    { "eventId": "f1-e21", "timestamp": "2026-10-05T17:15:20Z", "gameId": "football", "gameVersion": "1.0", "matchId": "foot-001", "playerId": "p3", "type": "PLAYER_ACTION", "action": "SHOT", "data": { "teamId": "B", "onTarget": true, "minute": 75 } },
    { "eventId": "f1-e22", "timestamp": "2026-10-05T17:15:21Z", "gameId": "football", "gameVersion": "1.0", "matchId": "foot-001", "playerId": "p3", "type": "PLAYER_ACTION", "action": "GOAL", "data": { "teamId": "B", "assistId": "p4", "minute": 75 } },

    { "eventId": "f1-e23", "timestamp": "2026-10-05T17:22:00Z", "gameId": "football", "gameVersion": "1.0", "matchId": "foot-001", "playerId": "p1", "type": "PLAYER_ACTION", "action": "FOUL", "data": { "teamId": "A", "card": "yellow", "minute": 82, "targetId": "p4" } },
    { "eventId": "f1-e24", "timestamp": "2026-10-05T17:25:00Z", "gameId": "football", "gameVersion": "1.0", "matchId": "foot-001", "playerId": "p4", "type": "PLAYER_DISCONNECTED", "data": {} },
    { "eventId": "f1-e25", "timestamp": "2026-10-05T17:26:00Z", "gameId": "football", "gameVersion": "1.0", "matchId": "foot-001", "playerId": "p4", "type": "PLAYER_RECONNECTED", "data": {} },

    { "eventId": "f1-e26", "timestamp": "2026-10-05T17:30:00Z", "gameId": "football", "gameVersion": "1.0", "matchId": "foot-001", "type": "MATCH_FINISHED", "data": {} }
  ]
}
