{
  "matchId": "fight-002",
  "gameId": "fighting",
  "gameVersion": "1.0",
  "startedAt": "2026-10-06T17:00:00Z",
  "finishedAt": "2026-10-06T17:02:38Z",
  "players": ["p3", "p4"],
  "events": [
    { "eventId": "x2-e01", "timestamp": "2026-10-06T17:00:00Z", "gameId": "fighting", "gameVersion": "1.0", "matchId": "fight-002", "type": "MATCH_STARTED", "data": { "stage": "living_forest", "rounds": 3 } },
    { "eventId": "x2-e02", "timestamp": "2026-10-06T17:00:01Z", "gameId": "fighting", "gameVersion": "1.0", "matchId": "fight-002", "playerId": "p3", "type": "PLAYER_JOINED", "data": { "character": "liu_kang" } },
    { "eventId": "x2-e03", "timestamp": "2026-10-06T17:00:02Z", "gameId": "fighting", "gameVersion": "1.0", "matchId": "fight-002", "playerId": "p4", "type": "PLAYER_JOINED", "data": { "character": "kitana" } },

    { "eventId": "x2-e04", "timestamp": "2026-10-06T17:00:10Z", "gameId": "fighting", "gameVersion": "1.0", "matchId": "fight-002", "playerId": "p3", "type": "PLAYER_ACTION", "action": "ATTACK", "data": { "targetId": "p4", "move": "punch", "hit": true, "damage": 15, "round": 1 } },
    { "eventId": "x2-e05", "timestamp": "2026-10-06T17:00:13Z", "gameId": "fighting", "gameVersion": "1.0", "matchId": "fight-002", "playerId": "p4", "type": "PLAYER_ACTION", "action": "ATTACK", "data": { "targetId": "p3", "move": "kick", "hit": true, "damage": 20, "round": 1 } },
    { "eventId": "x2-e06", "timestamp": "2026-10-06T17:00:16Z", "gameId": "fighting", "gameVersion": "1.0", "matchId": "fight-002", "playerId": "p3", "type": "PLAYER_ACTION", "action": "COMBO", "data": { "targetId": "p4", "hits": 3, "damage": 30, "round": 1 } },
    { "eventId": "x2-e07", "timestamp": "2026-10-06T17:00:19Z", "gameId": "fighting", "gameVersion": "1.0", "matchId": "fight-002", "playerId": "p4", "type": "PLAYER_ACTION", "action": "BLOCK", "data": { "attackerId": "p3", "round": 1 } },
    { "eventId": "x2-e08", "timestamp": "2026-10-06T17:00:22Z", "gameId": "fighting", "gameVersion": "1.0", "matchId": "fight-002", "playerId": "p3", "type": "PLAYER_ACTION", "action": "THROW", "data": { "targetId": "p4", "damage": 10, "round": 1 } },
    { "eventId": "x2-e09", "timestamp": "2026-10-06T17:00:25Z", "gameId": "fighting", "gameVersion": "1.0", "matchId": "fight-002", "playerId": "p4", "type": "PLAYER_ACTION", "action": "ATTACK", "data": { "targetId": "p3", "move": "punch", "hit": true, "damage": 20, "round": 1 } },
    { "eventId": "x2-e10", "timestamp": "2026-10-06T17:01:39Z", "gameId": "fighting", "gameVersion": "1.0", "matchId": "fight-002", "playerId": "p3", "type": "PLAYER_ACTION", "action": "ROUND_WON", "data": { "round": 1, "remainingHealth": 60, "method": "timeout" } },

    { "eventId": "x2-e11", "timestamp": "2026-10-06T17:01:50Z", "gameId": "fighting", "gameVersion": "1.0", "matchId": "fight-002", "playerId": "p4", "type": "PLAYER_ACTION", "action": "COMBO", "data": { "targetId": "p3", "hits": 5, "damage": 45, "round": 2 } },
    { "eventId": "x2-e12", "timestamp": "2026-10-06T17:01:53Z", "gameId": "fighting", "gameVersion": "1.0", "matchId": "fight-002", "playerId": "p3", "type": "PLAYER_ACTION", "action": "ATTACK", "data": { "targetId": "p4", "move": "kick", "hit": false, "damage": 0, "round": 2 } },
    { "eventId": "x2-e13", "timestamp": "2026-10-06T17:01:55Z", "gameId": "fighting", "gameVersion": "1.0", "matchId": "fight-002", "playerId": "p3", "type": "PLAYER_ACTION", "action": "ATTACK", "data": { "targetId": "p4", "move": "punch", "hit": true, "damage": 10, "round": 2 } },
    { "eventId": "x2-e14", "timestamp": "2026-10-06T17:02:00Z", "gameId": "fighting", "gameVersion": "1.0", "matchId": "fight-002", "playerId": "p4", "type": "PLAYER_ACTION", "action": "SPECIAL_MOVE", "data": { "targetId": "p3", "name": "fan_toss", "hit": true, "damage": 25, "round": 2 } },
    { "eventId": "x2-e15", "timestamp": "2026-10-06T17:02:01Z", "gameId": "fighting", "gameVersion": "1.0", "matchId": "fight-002", "playerId": "p4", "type": "PLAYER_ACTION", "action": "KNOCKDOWN", "data": { "targetId": "p3", "round": 2 } },
    { "eventId": "x2-e16", "timestamp": "2026-10-06T17:02:06Z", "gameId": "fighting", "gameVersion": "1.0", "matchId": "fight-002", "playerId": "p4", "type": "PLAYER_ACTION", "action": "ATTACK", "data": { "targetId": "p3", "move": "uppercut", "hit": true, "damage": 30, "round": 2 } },
    { "eventId": "x2-e17", "timestamp": "2026-10-06T17:02:07Z", "gameId": "fighting", "gameVersion": "1.0", "matchId": "fight-002", "playerId": "p4", "type": "PLAYER_ACTION", "action": "ROUND_WON", "data": { "round": 2, "remainingHealth": 90, "method": "ko" } },

    { "eventId": "x2-e18", "timestamp": "2026-10-06T17:02:20Z", "gameId": "fighting", "gameVersion": "1.0", "matchId": "fight-002", "playerId": "p3", "type": "PLAYER_ACTION", "action": "COMBO", "data": { "targetId": "p4", "hits": 4, "damage": 40, "round": 3 } },
    { "eventId": "x2-e19", "timestamp": "2026-10-06T17:02:23Z", "gameId": "fighting", "gameVersion": "1.0", "matchId": "fight-002", "playerId": "p3", "type": "PLAYER_ACTION", "action": "ATTACK", "data": { "targetId": "p4", "move": "punch", "hit": true, "damage": 15, "round": 3 } },
    { "eventId": "x2-e20", "timestamp": "2026-10-06T17:02:26Z", "gameId": "fighting", "gameVersion": "1.0", "matchId": "fight-002", "playerId": "p3", "type": "PLAYER_ACTION", "action": "SPECIAL_MOVE", "data": { "targetId": "p4", "name": "dragon_fire", "hit": true, "damage": 20, "round": 3 } },
    { "eventId": "x2-e21", "timestamp": "2026-10-06T17:02:30Z", "gameId": "fighting", "gameVersion": "1.0", "matchId": "fight-002", "playerId": "p4", "type": "PLAYER_ACTION", "action": "FATAL_BLOW", "data": { "targetId": "p3", "hit": true, "damage": 50, "health": 25, "round": 3 } },
    { "eventId": "x2-e22", "timestamp": "2026-10-06T17:02:33Z", "gameId": "fighting", "gameVersion": "1.0", "matchId": "fight-002", "playerId": "p4", "type": "PLAYER_ACTION", "action": "COMBO", "data": { "targetId": "p3", "hits": 3, "damage": 30, "round": 3 } },
    { "eventId": "x2-e23", "timestamp": "2026-10-06T17:02:36Z", "gameId": "fighting", "gameVersion": "1.0", "matchId": "fight-002", "playerId": "p4", "type": "PLAYER_ACTION", "action": "ATTACK", "data": { "targetId": "p3", "move": "uppercut", "hit": true, "damage": 20, "round": 3 } },
    { "eventId": "x2-e24", "timestamp": "2026-10-06T17:02:37Z", "gameId": "fighting", "gameVersion": "1.0", "matchId": "fight-002", "playerId": "p4", "type": "PLAYER_ACTION", "action": "ROUND_WON", "data": { "round": 3, "remainingHealth": 25, "method": "ko" } },

    { "eventId": "x2-e25", "timestamp": "2026-10-06T17:02:38Z", "gameId": "fighting", "gameVersion": "1.0", "matchId": "fight-002", "type": "MATCH_FINISHED", "data": {} }
  ]
}
