{
  "matchId": "race-003",
  "gameId": "racing",
  "gameVersion": "1.0",
  "startedAt": "2026-10-05T15:00:00Z",
  "finishedAt": "2026-10-05T15:05:00Z",
  "players": ["p1", "p2", "p3"],
  "events": [
    { "eventId": "r3-e01", "timestamp": "2026-10-05T15:00:00Z", "gameId": "racing", "gameVersion": "1.0", "matchId": "race-003", "type": "MATCH_STARTED", "data": { "track": "spa", "laps": 3 } },
    { "eventId": "r3-e02", "timestamp": "2026-10-05T15:00:01Z", "gameId": "racing", "gameVersion": "1.0", "matchId": "race-003", "playerId": "p1", "type": "PLAYER_JOINED", "data": {} },
    { "eventId": "r3-e03", "timestamp": "2026-10-05T15:00:02Z", "gameId": "racing", "gameVersion": "1.0", "matchId": "race-003", "playerId": "p2", "type": "PLAYER_JOINED", "data": {} },
    { "eventId": "r3-e04", "timestamp": "2026-10-05T15:00:03Z", "gameId": "racing", "gameVersion": "1.0", "matchId": "race-003", "playerId": "p3", "type": "PLAYER_JOINED", "data": {} },

    { "eventId": "r3-e05", "timestamp": "2026-10-05T15:00:20Z", "gameId": "racing", "gameVersion": "1.0", "matchId": "race-003", "playerId": "p1", "type": "PLAYER_ACTION", "action": "DRS_ACTIVATED", "data": { "lap": 1, "zone": 1 } },
    { "eventId": "r3-e06", "timestamp": "2026-10-05T15:00:21Z", "gameId": "racing", "gameVersion": "1.0", "matchId": "race-003", "playerId": "p1", "type": "PLAYER_ACTION", "action": "OVERTAKE", "data": { "lap": 1, "overtakenId": "p3" } },
    { "eventId": "r3-e07", "timestamp": "2026-10-05T15:00:21Z", "gameId": "racing", "gameVersion": "1.0", "matchId": "race-003", "playerId": "p1", "type": "PLAYER_ACTION", "action": "POSITION_CHANGED", "data": { "from": 3, "to": 2, "lap": 1 } },
    { "eventId": "r3-e08", "timestamp": "2026-10-05T15:00:21Z", "gameId": "racing", "gameVersion": "1.0", "matchId": "race-003", "playerId": "p3", "type": "PLAYER_ACTION", "action": "POSITION_CHANGED", "data": { "from": 2, "to": 3, "lap": 1 } },
    { "eventId": "r3-e09", "timestamp": "2026-10-05T15:00:27Z", "gameId": "racing", "gameVersion": "1.0", "matchId": "race-003", "playerId": "p2", "type": "PLAYER_ACTION", "action": "SECTOR_COMPLETED", "data": { "lap": 1, "sector": 1, "timeMs": 27000 } },
    { "eventId": "r3-e10", "timestamp": "2026-10-05T15:00:40Z", "gameId": "racing", "gameVersion": "1.0", "matchId": "race-003", "playerId": "p3", "type": "PLAYER_ACTION", "action": "WARNING", "data": { "lap": 1, "reason": "unsafe_driving" } },
    { "eventId": "r3-e11", "timestamp": "2026-10-05T15:00:55Z", "gameId": "racing", "gameVersion": "1.0", "matchId": "race-003", "playerId": "p2", "type": "PLAYER_ACTION", "action": "SECTOR_COMPLETED", "data": { "lap": 1, "sector": 2, "timeMs": 28000 } },
    { "eventId": "r3-e12", "timestamp": "2026-10-05T15:01:10Z", "gameId": "racing", "gameVersion": "1.0", "matchId": "race-003", "playerId": "p1", "type": "PLAYER_ACTION", "action": "SPEED_TRAP", "data": { "lap": 1, "speedKmh": 328.5 } },
    { "eventId": "r3-e13", "timestamp": "2026-10-05T15:01:22Z", "gameId": "racing", "gameVersion": "1.0", "matchId": "race-003", "playerId": "p2", "type": "PLAYER_ACTION", "action": "SECTOR_COMPLETED", "data": { "lap": 1, "sector": 3, "timeMs": 27000 } },
    { "eventId": "r3-e14", "timestamp": "2026-10-05T15:01:22Z", "gameId": "racing", "gameVersion": "1.0", "matchId": "race-003", "playerId": "p2", "type": "PLAYER_ACTION", "action": "LAP_COMPLETED", "data": { "lap": 1, "lapTimeMs": 82000, "position": 1 } },
    { "eventId": "r3-e15", "timestamp": "2026-10-05T15:01:22.300Z", "gameId": "racing", "gameVersion": "1.0", "matchId": "race-003", "playerId": "p1", "type": "PLAYER_ACTION", "action": "LAP_COMPLETED", "data": { "lap": 1, "lapTimeMs": 82300, "position": 2 } },
    { "eventId": "r3-e16", "timestamp": "2026-10-05T15:01:23Z", "gameId": "racing", "gameVersion": "1.0", "matchId": "race-003", "playerId": "p3", "type": "PLAYER_ACTION", "action": "LAP_COMPLETED", "data": { "lap": 1, "lapTimeMs": 83000, "position": 3 } },
    { "eventId": "r3-e17", "timestamp": "2026-10-05T15:01:24Z", "gameId": "racing", "gameVersion": "1.0", "matchId": "race-003", "playerId": "p2", "type": "PLAYER_ACTION", "action": "FUEL_LEVEL", "data": { "lap": 1, "percent": 62 } },
    { "eventId": "r3-e18", "timestamp": "2026-10-05T15:01:24Z", "gameId": "racing", "gameVersion": "1.0", "matchId": "race-003", "playerId": "p1", "type": "PLAYER_ACTION", "action": "FUEL_LEVEL", "data": { "lap": 1, "percent": 60 } },

    { "eventId": "r3-e19", "timestamp": "2026-10-05T15:01:40Z", "gameId": "racing", "gameVersion": "1.0", "matchId": "race-003", "playerId": "p1", "type": "PLAYER_ACTION", "action": "PIT_LANE_SPEEDING", "data": { "lap": 2, "speedKmh": 86.5, "limitKmh": 80 } },
    { "eventId": "r3-e20", "timestamp": "2026-10-05T15:01:52Z", "gameId": "racing", "gameVersion": "1.0", "matchId": "race-003", "playerId": "p1", "type": "PLAYER_ACTION", "action": "PIT_STOP", "data": { "lap": 2, "durationMs": 22000, "tiresChanged": true } },
    { "eventId": "r3-e21", "timestamp": "2026-10-05T15:01:52Z", "gameId": "racing", "gameVersion": "1.0", "matchId": "race-003", "playerId": "p1", "type": "PLAYER_ACTION", "action": "TIRE_CHANGE", "data": { "lap": 2, "compound": "hard" } },
    { "eventId": "r3-e22", "timestamp": "2026-10-05T15:01:53Z", "gameId": "racing", "gameVersion": "1.0", "matchId": "race-003", "playerId": "p1", "type": "PLAYER_ACTION", "action": "FUEL_LEVEL", "data": { "lap": 2, "percent": 95 } },
    { "eventId": "r3-e23", "timestamp": "2026-10-05T15:01:55Z", "gameId": "racing", "gameVersion": "1.0", "matchId": "race-003", "playerId": "p1", "type": "PLAYER_ACTION", "action": "POSITION_CHANGED", "data": { "from": 2, "to": 3, "lap": 2 } },
    { "eventId": "r3-e24", "timestamp": "2026-10-05T15:01:55Z", "gameId": "racing", "gameVersion": "1.0", "matchId": "race-003", "playerId": "p3", "type": "PLAYER_ACTION", "action": "POSITION_CHANGED", "data": { "from": 3, "to": 2, "lap": 2 } },
    { "eventId": "r3-e25", "timestamp": "2026-10-05T15:02:05Z", "gameId": "racing", "gameVersion": "1.0", "matchId": "race-003", "playerId": "p3", "type": "PLAYER_ACTION", "action": "BLUE_FLAG", "data": { "lap": 2, "lappedById": "p2" } },
    { "eventId": "r3-e26", "timestamp": "2026-10-05T15:02:20Z", "gameId": "racing", "gameVersion": "1.0", "matchId": "race-003", "playerId": "p3", "type": "PLAYER_ACTION", "action": "COLLISION", "data": { "lap": 2, "otherId": "p1", "damage": 70 } },
    { "eventId": "r3-e27", "timestamp": "2026-10-05T15:02:20Z", "gameId": "racing", "gameVersion": "1.0", "matchId": "race-003", "playerId": "p3", "type": "PLAYER_ACTION", "action": "SPIN", "data": { "lap": 2, "corner": 7 } },
    { "eventId": "r3-e28", "timestamp": "2026-10-05T15:02:21Z", "gameId": "racing", "gameVersion": "1.0", "matchId": "race-003", "playerId": "p3", "type": "PLAYER_ACTION", "action": "DNF", "data": { "lap": 2, "reason": "crash" } },
    { "eventId": "r3-e29", "timestamp": "2026-10-05T15:02:21Z", "gameId": "racing", "gameVersion": "1.0", "matchId": "race-003", "playerId": "p1", "type": "PLAYER_ACTION", "action": "POSITION_CHANGED", "data": { "from": 3, "to": 2, "lap": 2 } },
    { "eventId": "r3-e30", "timestamp": "2026-10-05T15:02:22Z", "gameId": "racing", "gameVersion": "1.0", "matchId": "race-003", "type": "MATCH_PAUSED", "data": { "reason": "red_flag" } },
    { "eventId": "r3-e31", "timestamp": "2026-10-05T15:02:52Z", "gameId": "racing", "gameVersion": "1.0", "matchId": "race-003", "type": "MATCH_RESUMED", "data": {} },
    { "eventId": "r3-e32", "timestamp": "2026-10-05T15:03:13.500Z", "gameId": "racing", "gameVersion": "1.0", "matchId": "race-003", "playerId": "p2", "type": "PLAYER_ACTION", "action": "LAP_COMPLETED", "data": { "lap": 2, "lapTimeMs": 81500, "position": 1 } },
    { "eventId": "r3-e33", "timestamp": "2026-10-05T15:03:14Z", "gameId": "racing", "gameVersion": "1.0", "matchId": "race-003", "playerId": "p2", "type": "PLAYER_ACTION", "action": "FUEL_LEVEL", "data": { "lap": 2, "percent": 41 } },
    { "eventId": "r3-e34", "timestamp": "2026-10-05T15:03:36.300Z", "gameId": "racing", "gameVersion": "1.0", "matchId": "race-003", "playerId": "p1", "type": "PLAYER_ACTION", "action": "LAP_COMPLETED", "data": { "lap": 2, "lapTimeMs": 104000, "position": 2 } },

    { "eventId": "r3-e35", "timestamp": "2026-10-05T15:04:00Z", "gameId": "racing", "gameVersion": "1.0", "matchId": "race-003", "playerId": "p1", "type": "PLAYER_ACTION", "action": "TRACK_LIMITS", "data": { "lap": 3, "corner": 4 } },
    { "eventId": "r3-e36", "timestamp": "2026-10-05T15:04:10Z", "gameId": "racing", "gameVersion": "1.0", "matchId": "race-003", "playerId": "p1", "type": "PLAYER_ACTION", "action": "PENALTY", "data": { "seconds": 5, "reason": "pit_lane_speeding" } },
    { "eventId": "r3-e37", "timestamp": "2026-10-05T15:04:34.700Z", "gameId": "racing", "gameVersion": "1.0", "matchId": "race-003", "playerId": "p2", "type": "PLAYER_ACTION", "action": "LAP_COMPLETED", "data": { "lap": 3, "lapTimeMs": 81200, "position": 1 } },
    { "eventId": "r3-e38", "timestamp": "2026-10-05T15:04:35Z", "gameId": "racing", "gameVersion": "1.0", "matchId": "race-003", "playerId": "p2", "type": "PLAYER_ACTION", "action": "FUEL_LEVEL", "data": { "lap": 3, "percent": 20 } },
    { "eventId": "r3-e39", "timestamp": "2026-10-05T15:04:57.300Z", "gameId": "racing", "gameVersion": "1.0", "matchId": "race-003", "playerId": "p1", "type": "PLAYER_ACTION", "action": "LAP_COMPLETED", "data": { "lap": 3, "lapTimeMs": 81000, "position": 2 } },
    { "eventId": "r3-e40", "timestamp": "2026-10-05T15:04:58Z", "gameId": "racing", "gameVersion": "1.0", "matchId": "race-003", "playerId": "p1", "type": "PLAYER_ACTION", "action": "FUEL_LEVEL", "data": { "lap": 3, "percent": 70 } },

    { "eventId": "r3-e41", "timestamp": "2026-10-05T15:05:00Z", "gameId": "racing", "gameVersion": "1.0", "matchId": "race-003", "type": "MATCH_FINISHED", "data": { "ranking": ["p2", "p1"] } }
  ]
}
