{
  "matchId": "foot-003",
  "gameId": "football",
  "gameVersion": "1.0",
  "startedAt": "2026-10-05T20:00:00Z",
  "finishedAt": "2026-10-05T21:45:00Z",
  "players": ["p1", "p2", "p3", "p4", "p5", "p6", "p7", "p8", "p9", "p10", "p11", "p12"],
  "events": [
    { "eventId": "f3-e01", "timestamp": "2026-10-05T20:00:00Z", "gameId": "football", "gameVersion": "1.0", "matchId": "foot-003", "type": "MATCH_STARTED", "data": { "homeTeam": "A", "awayTeam": "B" } },
    { "eventId": "f3-e02", "timestamp": "2026-10-05T20:00:01Z", "gameId": "football", "gameVersion": "1.0", "matchId": "foot-003", "playerId": "p1", "type": "PLAYER_JOINED", "data": { "teamId": "A" } },
    { "eventId": "f3-e03", "timestamp": "2026-10-05T20:00:02Z", "gameId": "football", "gameVersion": "1.0", "matchId": "foot-003", "playerId": "p2", "type": "PLAYER_JOINED", "data": { "teamId": "A" } },
    { "eventId": "f3-e04", "timestamp": "2026-10-05T20:00:03Z", "gameId": "football", "gameVersion": "1.0", "matchId": "foot-003", "playerId": "p3", "type": "PLAYER_JOINED", "data": { "teamId": "A" } },
    { "eventId": "f3-e05", "timestamp": "2026-10-05T20:00:04Z", "gameId": "football", "gameVersion": "1.0", "matchId": "foot-003", "playerId": "p4", "type": "PLAYER_JOINED", "data": { "teamId": "A" } },
    { "eventId": "f3-e06", "timestamp": "2026-10-05T20:00:05Z", "gameId": "football", "gameVersion": "1.0", "matchId": "foot-003", "playerId": "p5", "type": "PLAYER_JOINED", "data": { "teamId": "A" } },
    { "eventId": "f3-e07", "timestamp": "2026-10-05T20:00:06Z", "gameId": "football", "gameVersion": "1.0", "matchId": "foot-003", "playerId": "p6", "type": "PLAYER_JOINED", "data": { "teamId": "A" } },
    { "eventId": "f3-e08", "timestamp": "2026-10-05T20:00:07Z", "gameId": "football", "gameVersion": "1.0", "matchId": "foot-003", "playerId": "p7", "type": "PLAYER_JOINED", "data": { "teamId": "B" } },
    { "eventId": "f3-e09", "timestamp": "2026-10-05T20:00:08Z", "gameId": "football", "gameVersion": "1.0", "matchId": "foot-003", "playerId": "p8", "type": "PLAYER_JOINED", "data": { "teamId": "B" } },
    { "eventId": "f3-e10", "timestamp": "2026-10-05T20:00:09Z", "gameId": "football", "gameVersion": "1.0", "matchId": "foot-003", "playerId": "p9", "type": "PLAYER_JOINED", "data": { "teamId": "B" } },
    { "eventId": "f3-e11", "timestamp": "2026-10-05T20:00:10Z", "gameId": "football", "gameVersion": "1.0", "matchId": "foot-003", "playerId": "p10", "type": "PLAYER_JOINED", "data": { "teamId": "B" } },
    { "eventId": "f3-e12", "timestamp": "2026-10-05T20:00:11Z", "gameId": "football", "gameVersion": "1.0", "matchId": "foot-003", "playerId": "p11", "type": "PLAYER_JOINED", "data": { "teamId": "B" } },
    { "eventId": "f3-e13", "timestamp": "2026-10-05T20:00:12Z", "gameId": "football", "gameVersion": "1.0", "matchId": "foot-003", "playerId": "p12", "type": "PLAYER_JOINED", "data": { "teamId": "B" } },

    { "eventId": "f3-e14", "timestamp": "2026-10-05T20:03:00Z", "gameId": "football", "gameVersion": "1.0", "matchId": "foot-003", "playerId": "p2", "type": "PLAYER_ACTION", "action": "PASS", "data": { "teamId": "A", "targetId": "p3", "success": true, "distance": 18.5, "minute": 3 } },
    { "eventId": "f3-e15", "timestamp": "2026-10-05T20:03:20Z", "gameId": "football", "gameVersion": "1.0", "matchId": "foot-003", "playerId": "p3", "type": "PLAYER_ACTION", "action": "DRIBBLE", "data": { "teamId": "A", "success": true, "minute": 3 } },
    { "eventId": "f3-e16", "timestamp": "2026-10-05T20:04:00Z", "gameId": "football", "gameVersion": "1.0", "matchId": "foot-003", "playerId": "p3", "type": "PLAYER_ACTION", "action": "SHOT", "data": { "teamId": "A", "onTarget": true, "minute": 4 } },
    { "eventId": "f3-e17", "timestamp": "2026-10-05T20:04:01Z", "gameId": "football", "gameVersion": "1.0", "matchId": "foot-003", "playerId": "p7", "type": "PLAYER_ACTION", "action": "SAVE", "data": { "teamId": "B", "minute": 4 } },
    { "eventId": "f3-e18", "timestamp": "2026-10-05T20:06:00Z", "gameId": "football", "gameVersion": "1.0", "matchId": "foot-003", "playerId": "p4", "type": "PLAYER_ACTION", "action": "CORNER", "data": { "teamId": "A", "minute": 6 } },
    { "eventId": "f3-e19", "timestamp": "2026-10-05T20:08:00Z", "gameId": "football", "gameVersion": "1.0", "matchId": "foot-003", "playerId": "p8", "type": "PLAYER_ACTION", "action": "PASS", "data": { "teamId": "B", "targetId": "p9", "success": false, "distance": 25.5, "minute": 8 } },
    { "eventId": "f3-e20", "timestamp": "2026-10-05T20:08:05Z", "gameId": "football", "gameVersion": "1.0", "matchId": "foot-003", "playerId": "p5", "type": "PLAYER_ACTION", "action": "INTERCEPTION", "data": { "teamId": "A", "minute": 8 } },
    { "eventId": "f3-e21", "timestamp": "2026-10-05T20:10:00Z", "gameId": "football", "gameVersion": "1.0", "matchId": "foot-003", "playerId": "p9", "type": "PLAYER_ACTION", "action": "SHOT", "data": { "teamId": "B", "onTarget": true, "minute": 10 } },
    { "eventId": "f3-e22", "timestamp": "2026-10-05T20:10:01Z", "gameId": "football", "gameVersion": "1.0", "matchId": "foot-003", "playerId": "p1", "type": "PLAYER_ACTION", "action": "SAVE", "data": { "teamId": "A", "minute": 10 } },
    { "eventId": "f3-e23", "timestamp": "2026-10-05T20:12:00Z", "gameId": "football", "gameVersion": "1.0", "matchId": "foot-003", "playerId": "p10", "type": "PLAYER_ACTION", "action": "OWN_GOAL", "data": { "teamId": "B", "minute": 12 } },

    { "eventId": "f3-e24", "timestamp": "2026-10-05T20:20:00Z", "gameId": "football", "gameVersion": "1.0", "matchId": "foot-003", "playerId": "p11", "type": "PLAYER_ACTION", "action": "FOUL", "data": { "teamId": "B", "card": "yellow", "minute": 20, "targetId": "p2" } },
    { "eventId": "f3-e25", "timestamp": "2026-10-05T20:25:00Z", "gameId": "football", "gameVersion": "1.0", "matchId": "foot-003", "playerId": "p12", "type": "PLAYER_ACTION", "action": "TACKLE", "data": { "teamId": "B", "targetId": "p3", "success": true, "minute": 25 } },
    { "eventId": "f3-e26", "timestamp": "2026-10-05T20:30:00Z", "gameId": "football", "gameVersion": "1.0", "matchId": "foot-003", "playerId": "p4", "type": "PLAYER_ACTION", "action": "POWER_SHOT", "data": { "teamId": "A", "onTarget": true, "minute": 30 } },
    { "eventId": "f3-e27", "timestamp": "2026-10-05T20:30:01Z", "gameId": "football", "gameVersion": "1.0", "matchId": "foot-003", "playerId": "p4", "type": "PLAYER_ACTION", "action": "GOAL", "data": { "teamId": "A", "minute": 30 } },

    { "eventId": "f3-e28", "timestamp": "2026-10-05T20:45:00Z", "gameId": "football", "gameVersion": "1.0", "matchId": "foot-003", "type": "MATCH_PAUSED", "data": { "reason": "half_time" } },
    { "eventId": "f3-e29", "timestamp": "2026-10-05T21:00:00Z", "gameId": "football", "gameVersion": "1.0", "matchId": "foot-003", "type": "MATCH_RESUMED", "data": {} },

    { "eventId": "f3-e30", "timestamp": "2026-10-05T21:10:00Z", "gameId": "football", "gameVersion": "1.0", "matchId": "foot-003", "playerId": "p8", "type": "PLAYER_ACTION", "action": "DRIBBLE", "data": { "teamId": "B", "success": false, "minute": 55 } },
    { "eventId": "f3-e31", "timestamp": "2026-10-05T21:15:00Z", "gameId": "football", "gameVersion": "1.0", "matchId": "foot-003", "playerId": "p6", "type": "PLAYER_ACTION", "action": "TACKLE", "data": { "teamId": "A", "targetId": "p8", "success": true, "minute": 60 } },
    { "eventId": "f3-e32", "timestamp": "2026-10-05T21:17:00Z", "gameId": "football", "gameVersion": "1.0", "matchId": "foot-003", "playerId": "p12", "type": "PLAYER_ACTION", "action": "FOUL", "data": { "teamId": "B", "card": "red", "minute": 62, "targetId": "p6" } },
    { "eventId": "f3-e33", "timestamp": "2026-10-05T21:25:00Z", "gameId": "football", "gameVersion": "1.0", "matchId": "foot-003", "playerId": "p9", "type": "PLAYER_ACTION", "action": "POWER_SHOT", "data": { "teamId": "B", "onTarget": false, "minute": 70 } },
    { "eventId": "f3-e34", "timestamp": "2026-10-05T21:30:00Z", "gameId": "football", "gameVersion": "1.0", "matchId": "foot-003", "playerId": "p8", "type": "PLAYER_ACTION", "action": "CORNER", "data": { "teamId": "B", "minute": 75 } },
    { "eventId": "f3-e35", "timestamp": "2026-10-05T21:30:20Z", "gameId": "football", "gameVersion": "1.0", "matchId": "foot-003", "playerId": "p11", "type": "PLAYER_ACTION", "action": "SHOT", "data": { "teamId": "B", "onTarget": true, "minute": 75 } },
    { "eventId": "f3-e36", "timestamp": "2026-10-05T21:30:21Z", "gameId": "football", "gameVersion": "1.0", "matchId": "foot-003", "playerId": "p1", "type": "PLAYER_ACTION", "action": "SAVE", "data": { "teamId": "A", "minute": 75 } },
    { "eventId": "f3-e37", "timestamp": "2026-10-05T21:35:00Z", "gameId": "football", "gameVersion": "1.0", "matchId": "foot-003", "playerId": "p2", "type": "PLAYER_ACTION", "action": "PASS", "data": { "teamId": "A", "targetId": "p3", "success": true, "distance": 20.5, "minute": 80 } },
    { "eventId": "f3-e38", "timestamp": "2026-10-05T21:35:15Z", "gameId": "football", "gameVersion": "1.0", "matchId": "foot-003", "playerId": "p3", "type": "PLAYER_ACTION", "action": "SHOT", "data": { "teamId": "A", "onTarget": true, "minute": 80 } },
    { "eventId": "f3-e39", "timestamp": "2026-10-05T21:35:16Z", "gameId": "football", "gameVersion": "1.0", "matchId": "foot-003", "playerId": "p3", "type": "PLAYER_ACTION", "action": "GOAL", "data": { "teamId": "A", "assistId": "p2", "minute": 80 } },
    { "eventId": "f3-e40", "timestamp": "2026-10-05T21:43:00Z", "gameId": "football", "gameVersion": "1.0", "matchId": "foot-003", "playerId": "p9", "type": "PLAYER_ACTION", "action": "SHOT", "data": { "teamId": "B", "onTarget": false, "minute": 88 } },

    { "eventId": "f3-e41", "timestamp": "2026-10-05T21:45:00Z", "gameId": "football", "gameVersion": "1.0", "matchId": "foot-003", "type": "MATCH_FINISHED", "data": {} }
  ]
}
